{"algorithm_id":"A0-exhaustive/1","analyzer":{"authority":"none","model":"GPT-5.6 Sol","protocol":"reasoning-distiller-fixed-relation-analyzer/1"},"assessed_hypothesis_count":3584,"assessed_pair_count":512,"batch_id":"A0-B09-B11","benchmark_id":"relationship-discovery-v1","candidate_relations":[{"from_record_digest":"sha256:1f9da25bd4bf67e08c66e05b86dbf82bf0379b7afad99f70c4d885df979b442b","from_record_id":"pems:proposition:fe0b7d871680e370cc07b4b4","rationale":"The source supplies concrete verification evidence over provenance, strengthening the target claim over that governed boundary.","to_record_digest":"sha256:2f4a83b41f6441f1f6098150d4b9835a929210e4e71c851a8ab6c5ed6784ff50","to_record_id":"pems:proposition:da6eb634999eaa2457709e24","type":"supports"},{"from_record_digest":"sha256:9ca5df2318c94a959f49e857236055868daf750980c3708ae77a40d5b68e8eee","from_record_id":"pems:proposition:d493f395b47aa55f5062e906","rationale":"The source implements concrete behavior over admission, candidate, project, reconciliation, strengthening the target contract or plan for that governed boundary.","to_record_digest":"sha256:3daf285f01aa67468e8ee2d3b54bcb85a3c5f7aef595a3640472a1f2fdd9a0b0","to_record_id":"pems:proposition:fd7917d0d8763cb089dc2380","type":"supports"},{"from_record_digest":"sha256:d0437398644d35546801df2af0ad8599e57fc7aa22461e5f31d894a630f7743d","from_record_id":"pems:proposition:d8371ae110a7202452968848","rationale":"The source supplies concrete verification evidence over admission, evidence, project, strengthening the target claim over that governed boundary.","to_record_digest":"sha256:3daf285f01aa67468e8ee2d3b54bcb85a3c5f7aef595a3640472a1f2fdd9a0b0","to_record_id":"pems:proposition:fd7917d0d8763cb089dc2380","type":"supports"},{"from_record_digest":"sha256:c0b23cfd50760edefad3ba287634ceb99484056680001c2562e2417a5ec62eb0","from_record_id":"pems:proposition:d928a97b8d16e58762e2786c","rationale":"The source supplies concrete verification evidence over authority, canonical, role, strengthening the target claim over that governed boundary.","to_record_digest":"sha256:e0f61d98db2b72e688f289877393ae8728a4200c8433e92afd3011892cb32a9a","to_record_id":"pems:proposition:f8428d11730f4423ebe5aa49","type":"supports"},{"from_record_digest":"sha256:70fcb17be5aa985e410999a6e70780c52b8b63e3ba29dfd70e4aa2b794742c06","from_record_id":"pems:proposition:fa3ef0f33832008ef4610f59","rationale":"The source supplies concrete verification evidence over identity, project, strengthening the target claim over that governed boundary.","to_record_digest":"sha256:77d5834e4a3457eaf94734da19bb947379e2d0518f2573961f32d20f7e7b1fe4","to_record_id":"pems:proposition:d5a992f2bc12fffd54a7785a","type":"supports"},{"from_record_digest":"sha256:c0b23cfd50760edefad3ba287634ceb99484056680001c2562e2417a5ec62eb0","from_record_id":"pems:proposition:d928a97b8d16e58762e2786c","rationale":"The source supplies concrete verification evidence over authority, role, strengthening the target claim over that governed boundary.","to_record_digest":"sha256:d67a64536bdd532e981e627ec1944582d025fad7cf7c8168f9c7393d9626eb59","to_record_id":"pems:proposition:fa3253779af8abc6f3a409c0","type":"supports"},{"from_record_digest":"sha256:77d5834e4a3457eaf94734da19bb947379e2d0518f2573961f32d20f7e7b1fe4","from_record_id":"pems:proposition:d5a992f2bc12fffd54a7785a","rationale":"The source implements concrete behavior over admission, project, strengthening the target contract or plan for that governed boundary.","to_record_digest":"sha256:3daf285f01aa67468e8ee2d3b54bcb85a3c5f7aef595a3640472a1f2fdd9a0b0","to_record_id":"pems:proposition:fd7917d0d8763cb089dc2380","type":"supports"},{"from_record_digest":"sha256:17d6f689540781426f6b4be62b5de9bb21c02dc93cebe878f67f488ab929d66a","from_record_id":"pems:proposition:d59fb5ac65b5671a7cfaaf51","rationale":"The source supplies concrete verification evidence over authority, workflow, strengthening the target claim over that governed boundary.","to_record_digest":"sha256:8fedc0da7fa71db4cfd6347eea39d5e6a21832926ab84020c79f20e103e4d6f8","to_record_id":"pems:proposition:f90a96c54f8da5c578cf061d","type":"supports"},{"from_record_digest":"sha256:1f9da25bd4bf67e08c66e05b86dbf82bf0379b7afad99f70c4d885df979b442b","from_record_id":"pems:proposition:fe0b7d871680e370cc07b4b4","rationale":"The source supplies concrete verification evidence over provenance, rgp, strengthening the target claim over that governed boundary.","to_record_digest":"sha256:80e1d95142c324630b79bb040ab56532beafc0dca2315339b9353458fc073442","to_record_id":"pems:proposition:d6737b69d4c78195e5d8e6aa","type":"supports"},{"from_record_digest":"sha256:70fcb17be5aa985e410999a6e70780c52b8b63e3ba29dfd70e4aa2b794742c06","from_record_id":"pems:proposition:fa3ef0f33832008ef4610f59","rationale":"The source supplies concrete verification evidence over compatibility, project, strengthening the target claim over that governed boundary.","to_record_digest":"sha256:86c24a81f4871784593741eb7881dd514995f6ea790ba85b8d41720d4ace6cfb","to_record_id":"pems:proposition:d44f87579c505fe2d472785a","type":"supports"},{"from_record_digest":"sha256:8cecd38c4c4031931cbc70ba996d38f72a382017fe82f01b4c8208315cc71aa4","from_record_id":"pems:proposition:d3bb88c695ddded38acc57cf","rationale":"The source supplies concrete verification evidence over mutation, project, strengthening the target claim over that governed boundary.","to_record_digest":"sha256:e0f61d98db2b72e688f289877393ae8728a4200c8433e92afd3011892cb32a9a","to_record_id":"pems:proposition:f8428d11730f4423ebe5aa49","type":"supports"},{"from_record_digest":"sha256:af41ba22baaab239dcfee49357c15089a498e56b22bf5477d489f1a5b3222777","from_record_id":"pems:proposition:d4003b0e67559942dff02c18","rationale":"The source supplies concrete verification evidence over exceptional, recovery, strengthening the target claim over that governed boundary.","to_record_digest":"sha256:d67a64536bdd532e981e627ec1944582d025fad7cf7c8168f9c7393d9626eb59","to_record_id":"pems:proposition:fa3253779af8abc6f3a409c0","type":"supports"},{"from_record_digest":"sha256:9ca5df2318c94a959f49e857236055868daf750980c3708ae77a40d5b68e8eee","from_record_id":"pems:proposition:d493f395b47aa55f5062e906","rationale":"The source implements concrete behavior over authority, project, strengthening the target contract or plan for that governed boundary.","to_record_digest":"sha256:e0f61d98db2b72e688f289877393ae8728a4200c8433e92afd3011892cb32a9a","to_record_id":"pems:proposition:f8428d11730f4423ebe5aa49","type":"supports"},{"from_record_digest":"sha256:70fcb17be5aa985e410999a6e70780c52b8b63e3ba29dfd70e4aa2b794742c06","from_record_id":"pems:proposition:fa3ef0f33832008ef4610f59","rationale":"The source supplies concrete verification evidence over identity, project, strengthening the target claim over that governed boundary.","to_record_digest":"sha256:fa8787a292d5ba72ca43f351f202d6849d48a734064d0eab3ec89f4686ba3320","to_record_id":"pems:proposition:d9893bd87ae17e03c8105a32","type":"supports"}],"contract":"reasoning-distiller-relationship-analysis-result/1","input_batch_digest":"sha256:821e81a0c1e0d53974ff756489de0bc8b02ec6dd544f3d06e7658718019819ea","result_digest":"sha256:64227ad5b4fd88e669faee65441186574b67c9113de53854d67410931dc384e4","status":"COMPLETE"}
