{"algorithm_id":"A0-exhaustive/1","analyzer":{"authority":"none","model":"GPT-5.6 Sol","protocol":"reasoning-distiller-fixed-relation-analyzer/1"},"assessed_hypothesis_count":3472,"assessed_pair_count":496,"batch_id":"A0-B00-B00","benchmark_id":"relationship-discovery-v1","candidate_relations":[{"from_record_digest":"sha256:9be3f8853ac437946ea48af35cd849a7d5bde9d72d4554402e64f06d5c8f2039","from_record_id":"pems:proposition:01106db82e3e61013599154d","rationale":"The read-only checkpoint-adapter observation is a concrete Rupi boundary that strengthens the broader conformance proposition that Rupi has no alternate mutation or Canon-mutation path.","to_record_digest":"sha256:fd0a83aed2658cdbbe4ad117ed4888f842f9243c6a9fa9335333d9d3a583621f","to_record_id":"pems:proposition:1afe3ee45c79b3f231f0aa01","type":"supports"},{"from_record_digest":"sha256:895cba7e94714ecad000bb7e37a59b97d8d6e2e16dfe28eca259fb8a21271bc2","from_record_id":"pems:proposition:072fddb61b89d0a82b0317fb","rationale":"The update/recovery test observation strengthens the broader Rupi conformance proposition by showing update and recovery reuse accepted primitives, fail closed on drift, and preserve authority state.","to_record_digest":"sha256:fd0a83aed2658cdbbe4ad117ed4888f842f9243c6a9fa9335333d9d3a583621f","to_record_id":"pems:proposition:1afe3ee45c79b3f231f0aa01","type":"supports"},{"from_record_digest":"sha256:4d01f7d31293b1466153f4012a523721a47c482698b92b08266008aa3757722d","from_record_id":"pems:proposition:1061329363158516ff02dedf","rationale":"Keeping protected authority setup outside the install/bootstrap Rupi lifecycle strengthens the broader proposition that Rupi has no alternate authority system.","to_record_digest":"sha256:fd0a83aed2658cdbbe4ad117ed4888f842f9243c6a9fa9335333d9d3a583621f","to_record_id":"pems:proposition:1afe3ee45c79b3f231f0aa01","type":"supports"},{"from_record_digest":"sha256:0934a7bcd1c5679620b125d84d86e5588cb7327bf227771db13ec5719e8fdd19","from_record_id":"pems:proposition:121daf89460d56b10c028243","rationale":"The update/recovery test observation that Rupi performs no surfaced authority setup and does not report false success strengthens the broader adversarial conformance proposition.","to_record_digest":"sha256:fd0a83aed2658cdbbe4ad117ed4888f842f9243c6a9fa9335333d9d3a583621f","to_record_id":"pems:proposition:1afe3ee45c79b3f231f0aa01","type":"supports"},{"from_record_digest":"sha256:e1347adda9028dc3239c6fa4a68c013b1fd65fea2ca205372834e39ca05b53b6","from_record_id":"pems:proposition:12a8976258a5e212a78b485c","rationale":"The self-consumption isolation execution with adjacent source roots unavailable independently strengthens the production-invocation proposition that installed runtime operates without source-repository fallback.","to_record_digest":"sha256:2aa06c6a55982198b03f98177dda2e4985f796e1975b56de04e03f70bbb85241","to_record_id":"pems:proposition:17f5b1cfa9f51a7f6a7ec92e","type":"supports"}],"contract":"reasoning-distiller-relationship-analysis-result/1","input_batch_digest":"sha256:1d1c19261f769a4a87cd977baa58a0373df7b3ebea393da79fe9c69132ae65aa","result_digest":"sha256:e21b175254c5bf3788f8a3606f26353b7310066bfbc2d252ca20c08648da68f0","status":"COMPLETE"}
