{"algorithm_id":"A0-exhaustive/1","analyzer":{"authority":"none","model":"GPT-5.6 Sol","protocol":"reasoning-distiller-fixed-relation-analyzer/1"},"assessed_hypothesis_count":7168,"assessed_pair_count":1024,"batch_id":"A0-B02-B08","benchmark_id":"relationship-discovery-v1","candidate_relations":[{"from_record_digest":"sha256:c99c9a1178d9d81523afe433747d6ba31106755caa24152e18c6c4281971b29b","from_record_id":"pems:proposition:4b6f97b6dbe398af6eeb1be0","rationale":"The source states a more specific compatible constraint over admission, canonical, cove, pems, strengthening the target claim over the same governed boundary.","to_record_digest":"sha256:102da5e2549a671b70690bd29c10537cfd48e38a38c3b3cc041d6edb27f8ac50","to_record_id":"pems:proposition:c96f7d259014776d56cc50f6","type":"supports"},{"from_record_digest":"sha256:781e26a69925e274a3a7252a094fcf3464738d4ad1dc6a99764c4d67da565cba","from_record_id":"pems:proposition:3a95ab9750aa99012812b0ee","rationale":"The source supplies concrete verification evidence over identity, install, package, strengthening the target claim over that governed boundary.","to_record_digest":"sha256:759d2bbf3cefdaaf423bea8c75454e36031dc0301736fd686f4346466e652aa6","to_record_id":"pems:proposition:c7573f56fc5f65faaffb1947","type":"supports"},{"from_record_digest":"sha256:6659258364916c7cfaff6d119745234e52413dcc1393636061ae5aefb7cd9ee8","from_record_id":"pems:proposition:3bc055f78e0bd259b4c4deec","rationale":"The source supplies concrete verification evidence over canonical, cove, pems, strengthening the target claim over that governed boundary.","to_record_digest":"sha256:102da5e2549a671b70690bd29c10537cfd48e38a38c3b3cc041d6edb27f8ac50","to_record_id":"pems:proposition:c96f7d259014776d56cc50f6","type":"supports"},{"from_record_digest":"sha256:1184cc495a4987d010374c47d3c8c976347e1b0b77be8458dfafe99425216808","from_record_id":"pems:proposition:c9e5d1fde41ae6cf3cd76017","rationale":"The source states a more specific compatible constraint over authority, install, package, project, strengthening the target claim over the same governed boundary.","to_record_digest":"sha256:1a676f8d452ac99a43d953527ca813626b432c33e32c551341fc3c4c7eefe2df","to_record_id":"pems:proposition:43ace07192a09840a1a4c682","type":"supports"},{"from_record_digest":"sha256:2bdc7cf47d590c106b4fa2fdc4c6605015549c193fc66dd12b9d786dae1a2e95","from_record_id":"pems:proposition:3cc5e4e2e43e9df995f92023","rationale":"The source implements concrete behavior over identity, package, strengthening the target contract or plan for that governed boundary.","to_record_digest":"sha256:759d2bbf3cefdaaf423bea8c75454e36031dc0301736fd686f4346466e652aa6","to_record_id":"pems:proposition:c7573f56fc5f65faaffb1947","type":"supports"},{"from_record_digest":"sha256:29f3e778e1237045013448a00c2afc57caed2cd4cdc6fa8beb6b8e60be62b43d","from_record_id":"pems:proposition:c0b87d620dd8bc80a9b1f29c","rationale":"The source supplies concrete verification evidence over steward, strengthening the target claim over that governed boundary.","to_record_digest":"sha256:3c5abbbdd9ef06fa1875e1888f0e8be6fcffb8b16be3f861cfda7cdcce30eab7","to_record_id":"pems:proposition:485534addefcb9c5085f1735","type":"supports"},{"from_record_digest":"sha256:ac470cbe920ca6aaee013d5ae172c1c0b33a0dcd09aa73c8a305ab668895712c","from_record_id":"pems:proposition:390cde03ac0cfa46e485bd8a","rationale":"The source supplies concrete verification evidence over compatibility, pems, rgp, strengthening the target claim over that governed boundary.","to_record_digest":"sha256:afa49fbfcaca46de28aedd60e80dd9b1941fb4caf7853aff7e141a3d0b5517ce","to_record_id":"pems:proposition:c2bef8f1c8fe2d03329346dc","type":"supports"},{"from_record_digest":"sha256:759d2bbf3cefdaaf423bea8c75454e36031dc0301736fd686f4346466e652aa6","from_record_id":"pems:proposition:c7573f56fc5f65faaffb1947","rationale":"The source states a more specific compatible constraint over compatibility, install, package, strengthening the target claim over the same governed boundary.","to_record_digest":"sha256:1a676f8d452ac99a43d953527ca813626b432c33e32c551341fc3c4c7eefe2df","to_record_id":"pems:proposition:43ace07192a09840a1a4c682","type":"supports"},{"from_record_digest":"sha256:38dfa545d7509c98f346584ed06e282ab33a99d81cd718226e4d82587cd7f982","from_record_id":"pems:proposition:bfa70ad3728c8fe35db36635","rationale":"The source supplies concrete verification evidence over installer, recovery, strengthening the target claim over that governed boundary.","to_record_digest":"sha256:616f14241b573cc331a7048c53e97c3dcc172c9c06afb7b07b14d8557743dbaf","to_record_id":"pems:proposition:3775dfb65823362d048b1a90","type":"supports"},{"from_record_digest":"sha256:6fc94027ec9b5ee5bc39f469a67e197c3dbfd129236b958462cfbfa455a4db47","from_record_id":"pems:proposition:3f633e54dc3796ffb74366a3","rationale":"The source supplies concrete verification evidence over package, release, source, strengthening the target claim over that governed boundary.","to_record_digest":"sha256:759d2bbf3cefdaaf423bea8c75454e36031dc0301736fd686f4346466e652aa6","to_record_id":"pems:proposition:c7573f56fc5f65faaffb1947","type":"supports"},{"from_record_digest":"sha256:781e26a69925e274a3a7252a094fcf3464738d4ad1dc6a99764c4d67da565cba","from_record_id":"pems:proposition:3a95ab9750aa99012812b0ee","rationale":"The source supplies concrete verification evidence over install, package, strengthening the target claim over that governed boundary.","to_record_digest":"sha256:1184cc495a4987d010374c47d3c8c976347e1b0b77be8458dfafe99425216808","to_record_id":"pems:proposition:c9e5d1fde41ae6cf3cd76017","type":"supports"},{"from_record_digest":"sha256:6fb65a375ec971643becd5d9c84ad2347cb113ca0f551d64892445f15addfc8b","from_record_id":"pems:proposition:4ad62944c3e4bd0ede57d7fa","rationale":"The source implements concrete behavior over activation, authority, strengthening the target contract or plan for that governed boundary.","to_record_digest":"sha256:1184cc495a4987d010374c47d3c8c976347e1b0b77be8458dfafe99425216808","to_record_id":"pems:proposition:c9e5d1fde41ae6cf3cd76017","type":"supports"},{"from_record_digest":"sha256:56b81e7abdbcfbb5f09f3c75416da806a3796b047048b660ce51e70b456f913c","from_record_id":"pems:proposition:45b9116c81fca2745a4fcdaa","rationale":"The source implements concrete behavior over release, source, strengthening the target contract or plan for that governed boundary.","to_record_digest":"sha256:759d2bbf3cefdaaf423bea8c75454e36031dc0301736fd686f4346466e652aa6","to_record_id":"pems:proposition:c7573f56fc5f65faaffb1947","type":"supports"},{"from_record_digest":"sha256:1357c0609f9b62d01210a8f3baed33cd438c1a0df0b5e22d7e4222836f40a6c6","from_record_id":"pems:proposition:4f7612dd8fdf3e53d6c31418","rationale":"The source supplies concrete verification evidence over admission, canonical, pems, strengthening the target claim over that governed boundary.","to_record_digest":"sha256:102da5e2549a671b70690bd29c10537cfd48e38a38c3b3cc041d6edb27f8ac50","to_record_id":"pems:proposition:c96f7d259014776d56cc50f6","type":"supports"},{"from_record_digest":"sha256:785b0e266f19aef5d399a5d3613e07c0a9af6c2d8f3c3d68d3c6a5f72c4db447","from_record_id":"pems:proposition:bfd097abe7a2e3217eb4cf4f","rationale":"The source implements concrete behavior over installer, project, strengthening the target contract or plan for that governed boundary.","to_record_digest":"sha256:b012368539c90906f4e1769e321a521f77ab40ff56b1ee3e1024dbde82613745","to_record_id":"pems:proposition:432a878e32ae46fab19e7048","type":"supports"}],"contract":"reasoning-distiller-relationship-analysis-result/1","input_batch_digest":"sha256:56372266d13ab3a7c1247b97aa73694ba7cbd92eb4bf9ecf26476f3f44864b53","result_digest":"sha256:7a0604f3db2ea33a1bde2cbc80a3bee71602299448e33f250455d3d890c824dc","status":"COMPLETE"}
