{"algorithm_id":"A0-exhaustive/1","analyzer":{"authority":"none","model":"GPT-5.6 Sol","protocol":"reasoning-distiller-fixed-relation-analyzer/1"},"assessed_hypothesis_count":7168,"assessed_pair_count":1024,"batch_id":"A0-B01-B03","benchmark_id":"relationship-discovery-v1","candidate_relations":[{"from_record_digest":"sha256:bd76816c9a2d767a3f536859ae08fa4c5cb8bbd84fd8eaca45e0746ceb2b9623","from_record_id":"pems:proposition:52b90010825622107c2a1368","rationale":"The installation guide's requirement to select one exact accepted release before local installation strengthens the P8 release-baseline proposition tying publication to an exact source commit and immutable release artifacts.","to_record_digest":"sha256:82fad858f8666cc934cf24860d37997906b66f4c8561ced06b6ea3f3776bdc8c","to_record_id":"pems:proposition:1d8a0a7ae541986a41aa8b81","type":"supports"},{"from_record_digest":"sha256:f729506cd995e25a0d01c7f4a3a8c0fb8f5a275bb61381384d40e1c8a7436f8d","from_record_id":"pems:proposition:54432109dbb68d1ee9ae7f83","rationale":"The install-package manifest schema's binding of version, source commit, content identity, transport digest, compatibility, managed roots, and exact files strengthens the P8 accepted-release baseline.","to_record_digest":"sha256:82fad858f8666cc934cf24860d37997906b66f4c8561ced06b6ea3f3776bdc8c","to_record_id":"pems:proposition:1d8a0a7ae541986a41aa8b81","type":"supports"},{"from_record_digest":"sha256:f729506cd995e25a0d01c7f4a3a8c0fb8f5a275bb61381384d40e1c8a7436f8d","from_record_id":"pems:proposition:54432109dbb68d1ee9ae7f83","rationale":"The manifest schema defining exact content identity, managed roots, transport digest, and file entries strengthens the release-package builder proposition that it constructs and verifies canonical package identity.","to_record_digest":"sha256:548532b77e94b6f4cd5603863f7e061ae05cc3a68982faf18f449e03baa60115","to_record_id":"pems:proposition:286145105faa1fe88b0e3815","type":"supports"},{"from_record_digest":"sha256:f47af853764ae9f3a59c2e666d405c033dba8806a68f9982250ca616e43ba79e","from_record_id":"pems:proposition:58e4bef13920b5b1bfa67f97","rationale":"The install-package failure/recovery pressure suite strengthens the installer-runner requirement that validation and interrupted-operation failures preserve or restore the previous known installation.","to_record_digest":"sha256:2de48ddca2a26a29a1277dea92ba5480119b4bb92b55b5a912191ae0a0e99ab7","to_record_id":"pems:proposition:1d991cec0985bbdcd30bf5ee","type":"supports"},{"from_record_digest":"sha256:83d42f45c70c2a332f3585b8c61b06b199973235b82b4e20c7ec76121ac6e93d","from_record_id":"pems:proposition:5a123dab1086452322846c69","rationale":"The installation guide's package SHA-256 verification requirement strengthens the P8 release-baseline requirement for immutable transport and package identity.","to_record_digest":"sha256:82fad858f8666cc934cf24860d37997906b66f4c8561ced06b6ea3f3776bdc8c","to_record_id":"pems:proposition:1d8a0a7ae541986a41aa8b81","type":"supports"},{"from_record_digest":"sha256:7824cb5607ba14a16403e06845c333ad329f292002ad940e2f9b24ff90989539","from_record_id":"pems:proposition:5ac9cd23f93e97a2553634ac","rationale":"Install-package contract tests rejecting unsafe or unmanaged paths and generated installation metadata strengthen the package-build configuration's strict managed-root boundary.","to_record_digest":"sha256:aea68d44001ca0d5686f0ef854fa1ac00f4fa536693bc07d2b3b051d19873eb2","to_record_id":"pems:proposition:1b7fb780ddb0f6ad1bcbcd74","type":"supports"},{"from_record_digest":"sha256:21210a1f3131c1321c9f7a501c0a4f1f6b99b3dcb185834ff24482f597f56594","from_record_id":"pems:proposition:5f5ab50cf4aa7a0999284a15","rationale":"The install-package contract's separation of framework-managed state from project knowledge, authority, evidence, and canonical state strengthens the package-build configuration's exclusion of project-owned material.","to_record_digest":"sha256:aea68d44001ca0d5686f0ef854fa1ac00f4fa536693bc07d2b3b051d19873eb2","to_record_id":"pems:proposition:1b7fb780ddb0f6ad1bcbcd74","type":"supports"},{"from_record_digest":"sha256:21210a1f3131c1321c9f7a501c0a4f1f6b99b3dcb185834ff24482f597f56594","from_record_id":"pems:proposition:5f5ab50cf4aa7a0999284a15","rationale":"Keeping project knowledge, authority, policy, evidence, and canonical state outside the framework-managed root strengthens the consumer-migration requirement to preserve project-owned knowledge and authority.","to_record_digest":"sha256:e127b0b4ba9e812bfe4cec9d3876486b253ed1a98e12b3b9c68bb9318daf4d6e","to_record_id":"pems:proposition:2ff19e1cee25bd589bd72584","type":"supports"},{"from_record_digest":"sha256:72ad7831f510432412c48728de28e871bcde1cf113e3c0593cf3a1b99c09502d","from_record_id":"pems:proposition:6003199c9ac38262bed0242c","rationale":"The P7 update proof using the same installer mechanism rather than a separate updater strengthens the migration record's move from cross-repository runtime coupling to an installed project-local framework.","to_record_digest":"sha256:e127b0b4ba9e812bfe4cec9d3876486b253ed1a98e12b3b9c68bb9318daf4d6e","to_record_id":"pems:proposition:2ff19e1cee25bd589bd72584","type":"supports"},{"from_record_digest":"sha256:1599fa4d03ab8a8d942b49a54c801e0c04bda6ded6c6e898da5ee379357c6fde","from_record_id":"pems:proposition:59a088378e1f2c2583237374","rationale":"The README's explicit statement that the project Steward owns reconciliation and admission authority strengthens the Steward-authorization contract's independent scoped-authority model.","to_record_digest":"sha256:66ca6cdd519ec521edf56ac20635ce51ef95cb4b3f80b77895aab56e934143f0","to_record_id":"pems:proposition:2b44034c925803193972b8a2","type":"supports"},{"from_record_digest":"sha256:7fa8703331937294ae907ed630b83e11df8d9fee812c1b0e5f3506b393c4f154","from_record_id":"pems:proposition:5841a78021627cc478149f7f","rationale":"The Distiller core's no-model, no-admission, no-canonical-mutation, and no-source-fallback implementation strengthens the distillation-ingestion operation's non-model, non-canonical preparation boundary.","to_record_digest":"sha256:e60d2b2225f502b1421d88978577e23a1f5b7db83e544a0096e6e4ef32054a8b","to_record_id":"pems:proposition:23e1493f255d1a1845c2e89a","type":"supports"},{"from_record_digest":"sha256:df07a6d1851b3580145ad70ab5181f0d687748e45bd8127aa6d00479376e02cf","from_record_id":"pems:proposition:5e53cea62207805bc1f55a90","rationale":"Governed ingestion's explicit-selection rule and prohibition on inferring authority from filenames or prose strengthen the Distiller entrypoint's closed, explicit ingestion-source typing.","to_record_digest":"sha256:965d2ae768bc1d9bd3fae43745d582effe6f36a26abc07f56fbb5ef9fb174036","to_record_id":"pems:proposition:1d12167fce0b8c7cc6dc3986","type":"supports"},{"from_record_digest":"sha256:06a6e65f5412d7fc5f2822ca22a5e668507d5cb9f9928bc5a74fd8e1ae09bfd2","from_record_id":"pems:proposition:5e1354ab74f97461a4fdfd34","rationale":"The scoring rubric's hard failures for fabricated provenance, invented decisions, and unsupported causal relations strengthen the Phase 0 rule that scoring diagnostics remain separate from the durable candidate graph.","to_record_digest":"sha256:79abd941d83b7cec9ac9d0c80aa4edc95a631a35e1ad0573426ed7ccf888f339","to_record_id":"pems:proposition:25d9da391ef7aafa384b91b8","type":"supports"},{"from_record_digest":"sha256:bcb0f683b5463348aec8f70e28fb419fe1b8aabae9f2ae3d3795a6bbd77e30b8","from_record_id":"pems:proposition:5a7d03e54c5e66e3b7c1a8f3","rationale":"Automation-boundary tests proving materiality cannot be bypassed by an in-scope grant strengthen the Human-to-Agent contract's rule that grants cannot waive or consume required materiality acknowledgement.","to_record_digest":"sha256:2950d0b8e6173c8142fb39c18c1ea4686d9ca64c7bcf48e551d755c5aa5783cc","to_record_id":"pems:proposition:2b1580416e7db59072f1fcb9","type":"supports"},{"from_record_digest":"sha256:f0d3d5f49fc80d4f0bbdc16841c9be83ffad9f701599f5d664589926f98ef54b","from_record_id":"pems:proposition:5e5731deeade4b9631566281","rationale":"Automation-boundary tests rejecting stale, exhausted, ambiguous, expanded, or protected grant operations strengthen the grant-operations runtime's bounded rather than unrestricted authority behavior.","to_record_digest":"sha256:e93637c4b4d9d31c2e47ad47d913ea97e318da23bd391e496d8efdc1e98b087a","to_record_id":"pems:proposition:27ec4ad113d17fb1a9356735","type":"supports"},{"from_record_digest":"sha256:5fd78dadb6228d43f09a592859b10ae22164573eedfdd67ef2446d2ffed5c4b9","from_record_id":"pems:proposition:5f7e87d58fdcb6750b127839","rationale":"The installer-runner managed-drift fail-closed requirement strengthens the broader failed-validation contract requiring the previous known installation to be preserved or restored.","to_record_digest":"sha256:2de48ddca2a26a29a1277dea92ba5480119b4bb92b55b5a912191ae0a0e99ab7","to_record_id":"pems:proposition:1d991cec0985bbdcd30bf5ee","type":"supports"}],"contract":"reasoning-distiller-relationship-analysis-result/1","input_batch_digest":"sha256:180a0906a6b88454945e3d1f2a531c26f4bf2907c5e5e4114ab6bdc86a1caaa7","result_digest":"sha256:90c479626c9952ecb33b7c854a65e8356f510c546f52f1027bdcd82fd875b2e4","status":"COMPLETE"}
