{"algorithm_id":"A0-exhaustive/1","analyzer":{"authority":"none","model":"GPT-5.6 Sol","protocol":"reasoning-distiller-fixed-relation-analyzer/1"},"assessed_hypothesis_count":3472,"assessed_pair_count":496,"batch_id":"A0-B07-B07","benchmark_id":"relationship-discovery-v1","candidate_relations":[{"from_record_digest":"sha256:9e2f2cae124c639ae45daca36c69804882083cffa80da4261a6bf6f5ec37414a","from_record_id":"pems:proposition:b836cade15ddbcfed78b8b41","rationale":"The source supplies concrete verification evidence over candidate, strengthening the target claim over that governed boundary.","to_record_digest":"sha256:2d46563f1ca7b2df43886d40f7c51ae2284bf547d240068a4db3c576e0dd72a0","to_record_id":"pems:proposition:b8474873fa869037f8a0438e","type":"supports"},{"from_record_digest":"sha256:9e2f2cae124c639ae45daca36c69804882083cffa80da4261a6bf6f5ec37414a","from_record_id":"pems:proposition:b836cade15ddbcfed78b8b41","rationale":"The source supplies concrete verification evidence over candidate, submission, strengthening the target claim over that governed boundary.","to_record_digest":"sha256:ef6096cc58879cbe5bd5a6179f71c83fbddc4b3354104e0f2d5c532c6c030efc","to_record_id":"pems:proposition:b323fc3103599b32373489c3","type":"supports"},{"from_record_digest":"sha256:ef6096cc58879cbe5bd5a6179f71c83fbddc4b3354104e0f2d5c532c6c030efc","from_record_id":"pems:proposition:b323fc3103599b32373489c3","rationale":"The source states a more specific compatible constraint over admission, candidate, reconciliation, submission, strengthening the target claim over the same governed boundary.","to_record_digest":"sha256:4492d1de1c3db1e611c6e3b64a399ad682cd67fb4ad03819e5219099b69bfae3","to_record_id":"pems:proposition:bcd4e8b565d6334b417e6745","type":"supports"},{"from_record_digest":"sha256:9e2f2cae124c639ae45daca36c69804882083cffa80da4261a6bf6f5ec37414a","from_record_id":"pems:proposition:b836cade15ddbcfed78b8b41","rationale":"The source supplies concrete verification evidence over candidate, submission, strengthening the target claim over that governed boundary.","to_record_digest":"sha256:4492d1de1c3db1e611c6e3b64a399ad682cd67fb4ad03819e5219099b69bfae3","to_record_id":"pems:proposition:bcd4e8b565d6334b417e6745","type":"supports"},{"from_record_digest":"sha256:d7e76416ee37f44690519f7237445afafa6b25710fad9c92929aa578ce4ee283","from_record_id":"pems:proposition:b514f9c1f202fc360fc23aaa","rationale":"The source supplies concrete verification evidence over authority, grant, strengthening the target claim over that governed boundary.","to_record_digest":"sha256:89109e740311d18d9644ace6d3f61532c0a6d15d463a6187a0747a6756417521","to_record_id":"pems:proposition:b32ba462b7126ee805f35e78","type":"supports"}],"contract":"reasoning-distiller-relationship-analysis-result/1","input_batch_digest":"sha256:d26ecca639bc44a8012b9ec8ca836ed22cb0deb585777c8dee3136084e30242e","result_digest":"sha256:a3c881872e16513b58ff95e15630446572041c647aded69a0d684f4b5ff49310","status":"COMPLETE"}
