{"algorithm_id":"A0-exhaustive/1","analyzer":{"authority":"none","model":"GPT-5.6 Sol","protocol":"reasoning-distiller-fixed-relation-analyzer/1"},"assessed_hypothesis_count":7168,"assessed_pair_count":1024,"batch_id":"A0-B00-B03","benchmark_id":"relationship-discovery-v1","candidate_relations":[{"from_record_digest":"sha256:47f7bf11f53eb6e16e130434c640b2e12b23fa6cacfa5e5d595644e120bf240c","from_record_id":"pems:proposition:53120f70ac66ded8f7743a19","rationale":"The checkpoint tests independently verify deterministic non-mutating construction and fail-closed handling of malformed primitive observations, strengthening the checkpoint-adapter proposition that the adapter is read-only.","to_record_digest":"sha256:9be3f8853ac437946ea48af35cd849a7d5bde9d72d4554402e64f06d5c8f2039","to_record_id":"pems:proposition:01106db82e3e61013599154d","type":"supports"},{"from_record_digest":"sha256:f729506cd995e25a0d01c7f4a3a8c0fb8f5a275bb61381384d40e1c8a7436f8d","from_record_id":"pems:proposition:54432109dbb68d1ee9ae7f83","rationale":"The manifest schema binds content identity and transport SHA-256 as distinct fields alongside semantic package metadata, strengthening the accepted contract's separation of semantic content identity from exact transport-byte integrity.","to_record_digest":"sha256:18b63a81d3d55a642fb2896ef58c7ec7712465535f2ec2d4e1254fcf02b96090","to_record_id":"pems:proposition:1429c6189decbce4202e5cce","type":"supports"},{"from_record_digest":"sha256:6fe475c825295a2b3d66c73724c1694e5276787550b7cb7ee0318fb1f03f60e4","from_record_id":"pems:proposition:0f32f881819d9e8031bfeb91","rationale":"The project-identity bridge tests verify that v2 identity is valid bootstrap state and that first admission reuses that exact identity, strengthening the project-identity amendment's first-admission project-seeding requirement.","to_record_digest":"sha256:d4b0fc7ffa9d4719167140aec608ee60940991742153900014ffbe19048cee79","to_record_id":"pems:proposition:61e05ab20e4667baaa5fb2a1","type":"supports"},{"from_record_digest":"sha256:5d4eefb612451eaa25776dda36263730e961ca40a0dbb83dd7d292d9639b8016","from_record_id":"pems:proposition:135a86b970c68d4d881b4ab2","rationale":"The mutation runtime's explicit proposal revalidation and validation of proposal/approval artifacts before state transitions strengthens the adapter contracts requiring proposal applicability to be revalidated immediately before fresh direct approval.","to_record_digest":"sha256:4dd902ee0317fc1ceaf10763454756d9fc6bb4b506279f3c1e69c8cc291c48e9","to_record_id":"pems:proposition:52af25e2c68c8139e68a18cd","type":"supports"},{"from_record_digest":"sha256:2aa06c6a55982198b03f98177dda2e4985f796e1975b56de04e03f70bbb85241","from_record_id":"pems:proposition:17f5b1cfa9f51a7f6a7ec92e","rationale":"The production-invocation tests independently verify operation without source-repository fallback and unchanged project-owned canonical bytes, strengthening the Distiller-core proposition that it has no source-repository fallback or canonical mutation path.","to_record_digest":"sha256:7fa8703331937294ae907ed630b83e11df8d9fee812c1b0e5f3506b393c4f154","to_record_id":"pems:proposition:5841a78021627cc478149f7f","type":"supports"},{"from_record_digest":"sha256:5e17006fbfe1eb7deecf64b6bf59b42ffd576b82416d3d0fc404e4d1506da973","from_record_id":"pems:proposition:5ec8fa7542882e073c799c10","rationale":"The narrower installer-runner contract statement that package retrieval and release selection stay outside installer execution directly strengthens the broader rd_install.py runner contract containing the same boundary.","to_record_digest":"sha256:f8582233a3e8a40e68761a67c4f20fa635eabd0a19e6f4ff128b93f4eb28c193","to_record_id":"pems:proposition:1906ff6fd7e170de0ece854b","type":"supports"},{"from_record_digest":"sha256:895cba7e94714ecad000bb7e37a59b97d8d6e2e16dfe28eca259fb8a21271bc2","from_record_id":"pems:proposition:072fddb61b89d0a82b0317fb","rationale":"The Rupi update/recovery tests verify recovery requires bounded intent and replanning while update reuses accepted installer mutation, strengthening the R6 amendment's shared-orchestration and fresh-transition-planning requirements.","to_record_digest":"sha256:036f7351bbc0c38ab3b6b54f0e5a1ecb3f6e0a339d9446bf09a6362d658c6d9b","to_record_id":"pems:proposition:536a0bea19029e175942d9f9","type":"supports"},{"from_record_digest":"sha256:7824cb5607ba14a16403e06845c333ad329f292002ad940e2f9b24ff90989539","from_record_id":"pems:proposition:5ac9cd23f93e97a2553634ac","rationale":"The install-package contract tests reject malformed paths, invalid modes/digests, and incorrect content identity, strengthening the accepted install-package contract's integrity and semantic-identity requirements.","to_record_digest":"sha256:18b63a81d3d55a642fb2896ef58c7ec7712465535f2ec2d4e1254fcf02b96090","to_record_id":"pems:proposition:1429c6189decbce4202e5cce","type":"supports"},{"from_record_digest":"sha256:895cba7e94714ecad000bb7e37a59b97d8d6e2e16dfe28eca259fb8a21271bc2","from_record_id":"pems:proposition:072fddb61b89d0a82b0317fb","rationale":"The Rupi update/recovery tests independently verify managed drift stops mutation, strengthening the installer-runner contract's fail-closed managed-drift requirement.","to_record_digest":"sha256:5fd78dadb6228d43f09a592859b10ae22164573eedfdd67ef2446d2ffed5c4b9","to_record_id":"pems:proposition:5f7e87d58fdcb6750b127839","type":"supports"},{"from_record_digest":"sha256:2aa06c6a55982198b03f98177dda2e4985f796e1975b56de04e03f70bbb85241","from_record_id":"pems:proposition:17f5b1cfa9f51a7f6a7ec92e","rationale":"The production-invocation tests' byte-for-byte preservation of project-owned authority and canonical state strengthens the install-package contract boundary that project knowledge and authority remain outside the framework-managed root.","to_record_digest":"sha256:21210a1f3131c1321c9f7a501c0a4f1f6b99b3dcb185834ff24482f597f56594","to_record_id":"pems:proposition:5f5ab50cf4aa7a0999284a15","type":"supports"}],"contract":"reasoning-distiller-relationship-analysis-result/1","input_batch_digest":"sha256:377737b85aa1eb0bad4b6b48c6eb99d2ac994fb30e27ddb28878d5896304b962","result_digest":"sha256:7a3243c2205962039b6d45c423408177fe2e5a54dff587a9afaca0f8c7fba1e0","status":"COMPLETE"}
