{"algorithm_id":"A0-exhaustive/1","analyzer":{"authority":"none","model":"GPT-5.6 Sol","protocol":"reasoning-distiller-fixed-relation-analyzer/1"},"assessed_hypothesis_count":7168,"assessed_pair_count":1024,"batch_id":"A0-B06-B07","benchmark_id":"relationship-discovery-v1","candidate_relations":[{"from_record_digest":"sha256:fa10f7079c33a6123820784b3d1808bac1f1d466f252758e63011e8f3393bb9c","from_record_id":"pems:proposition:b98458431bee2b5169000325","rationale":"The source implements concrete behavior over identity, project, strengthening the target contract or plan for that governed boundary.","to_record_digest":"sha256:fdacb23c7302dd5ea005e3531b0bf9855c0671bcf9741bf0bb0db8c758233933","to_record_id":"pems:proposition:9b7d13b1071a08fc98462842","type":"supports"},{"from_record_digest":"sha256:138042f7f9a2e76a076e3cc79880a0fbc403ea2bc3df3d81df68dd94995d1368","from_record_id":"pems:proposition:a7f7301047ce92780c3b3dba","rationale":"The source supplies concrete verification evidence over grant, orchestration, workflow, strengthening the target claim over that governed boundary.","to_record_digest":"sha256:62efb97dd46b7632159bf2ec36931ae97d7399c8d426e612085df3696fbd4a8f","to_record_id":"pems:proposition:bb356746201401da7654c7e9","type":"supports"},{"from_record_digest":"sha256:9e2f2cae124c639ae45daca36c69804882083cffa80da4261a6bf6f5ec37414a","from_record_id":"pems:proposition:b836cade15ddbcfed78b8b41","rationale":"The source supplies concrete verification evidence over evidence, submission, strengthening the target claim over that governed boundary.","to_record_digest":"sha256:dc0723f3ce17287ef1ad65aecd85ebccb2297e9265f69be692ed315bb1a62ff6","to_record_id":"pems:proposition:a5fb6ec8cdf893823853352e","type":"supports"},{"from_record_digest":"sha256:063b15132db6d4cbb2d3b22c59ec1997c4150c14353b09017067cca0c6cce78d","from_record_id":"pems:proposition:bc715bd4810ec6e01f0f197c","rationale":"The source supplies concrete verification evidence over status, strengthening the target claim over that governed boundary.","to_record_digest":"sha256:259351518ef51e8444cc3c77d50a186a7c7338c909c1cf06396eba5b1c612701","to_record_id":"pems:proposition:abe528b2013354401c957e8c","type":"supports"},{"from_record_digest":"sha256:d7e76416ee37f44690519f7237445afafa6b25710fad9c92929aa578ce4ee283","from_record_id":"pems:proposition:b514f9c1f202fc360fc23aaa","rationale":"The source supplies concrete verification evidence over authority, grant, strengthening the target claim over that governed boundary.","to_record_digest":"sha256:3f741f3d070c7fc70669c7472abd3a610f411fc09e488f4ea9166749d2a984fd","to_record_id":"pems:proposition:97fa3ce5267f6c4a0c2e2e83","type":"supports"},{"from_record_digest":"sha256:8a4deb46ab35cb167343056ab15b1231981b08eb408d2ba4e5509e8aff2e5e6e","from_record_id":"pems:proposition:98360aee45b4feea77eb5ba2","rationale":"The source supplies concrete verification evidence over admission, authority, reconciliation, steward, strengthening the target claim over that governed boundary.","to_record_digest":"sha256:89109e740311d18d9644ace6d3f61532c0a6d15d463a6187a0747a6756417521","to_record_id":"pems:proposition:b32ba462b7126ee805f35e78","type":"supports"},{"from_record_digest":"sha256:c64a962f1ad9720490ad4abf829214142f93752b6cf7c153e4d49438eb33cb75","from_record_id":"pems:proposition:a48544103c48133a795a8d67","rationale":"The source implements concrete behavior over candidate, reconciliation, strengthening the target contract or plan for that governed boundary.","to_record_digest":"sha256:4492d1de1c3db1e611c6e3b64a399ad682cd67fb4ad03819e5219099b69bfae3","to_record_id":"pems:proposition:bcd4e8b565d6334b417e6745","type":"supports"},{"from_record_digest":"sha256:9e2f2cae124c639ae45daca36c69804882083cffa80da4261a6bf6f5ec37414a","from_record_id":"pems:proposition:b836cade15ddbcfed78b8b41","rationale":"The source supplies concrete verification evidence over evidence, submission, strengthening the target claim over that governed boundary.","to_record_digest":"sha256:d79a47469e1c02bc11a8872169aac001b67990d6383bd9fa1659e4e33079e83e","to_record_id":"pems:proposition:9d1555e3ad1c44767c0eb9f5","type":"supports"},{"from_record_digest":"sha256:8a4deb46ab35cb167343056ab15b1231981b08eb408d2ba4e5509e8aff2e5e6e","from_record_id":"pems:proposition:98360aee45b4feea77eb5ba2","rationale":"The source supplies concrete verification evidence over admission, reconciliation, steward, strengthening the target claim over that governed boundary.","to_record_digest":"sha256:4492d1de1c3db1e611c6e3b64a399ad682cd67fb4ad03819e5219099b69bfae3","to_record_id":"pems:proposition:bcd4e8b565d6334b417e6745","type":"supports"},{"from_record_digest":"sha256:8a4deb46ab35cb167343056ab15b1231981b08eb408d2ba4e5509e8aff2e5e6e","from_record_id":"pems:proposition:98360aee45b4feea77eb5ba2","rationale":"The source supplies concrete verification evidence over admission, authority, reconciliation, strengthening the target claim over that governed boundary.","to_record_digest":"sha256:ef6096cc58879cbe5bd5a6179f71c83fbddc4b3354104e0f2d5c532c6c030efc","to_record_id":"pems:proposition:b323fc3103599b32373489c3","type":"supports"}],"contract":"reasoning-distiller-relationship-analysis-result/1","input_batch_digest":"sha256:1d066601c50e635aa0a148eff0df482def1cb74b0b22f4febc9392709a8466a3","result_digest":"sha256:3120322aa4087c3167f54561f462b94d06399e5f7bb7e65e9ab3cf7f6b3cc713","status":"COMPLETE"}
