{"algorithm_id":"A0-exhaustive/1","analyzer":{"authority":"none","model":"GPT-5.6 Sol","protocol":"reasoning-distiller-fixed-relation-analyzer/1"},"assessed_hypothesis_count":3472,"assessed_pair_count":496,"batch_id":"A0-B10-B10","benchmark_id":"relationship-discovery-v1","candidate_relations":[{"from_record_digest":"sha256:f10d70fb0c68b60b8769d20c9407a26df04da72ae5175c8a4c03c3315eedb214","from_record_id":"pems:proposition:edaa40e0712a372141d8816d","rationale":"The source states a more specific compatible constraint over agent, authority, grant, workflow, strengthening the target claim over the same governed boundary.","to_record_digest":"sha256:15b30c20c24c2b252b7c0139fa28e1891209e4eb3d8f533519da125848b4f6d1","to_record_id":"pems:proposition:f0c4b0034c1ec3ad2f879130","type":"supports"},{"from_record_digest":"sha256:7e631cf073d27067f3f01b121a2c710f0fac3ab7d6f0daabc6c5543fd1d360cd","from_record_id":"pems:proposition:e5eaf92a135afabfaaffee2d","rationale":"The source supplies concrete verification evidence over agent, human, strengthening the target claim over that governed boundary.","to_record_digest":"sha256:15b30c20c24c2b252b7c0139fa28e1891209e4eb3d8f533519da125848b4f6d1","to_record_id":"pems:proposition:f0c4b0034c1ec3ad2f879130","type":"supports"},{"from_record_digest":"sha256:9420f1d57c26e80c8fc14cfd495bebbb75032f6e43d0c75aeeae171b268fa588","from_record_id":"pems:proposition:e974d3b9db7ef8468f84c63d","rationale":"The source implements concrete behavior over authority, human, strengthening the target contract or plan for that governed boundary.","to_record_digest":"sha256:15b30c20c24c2b252b7c0139fa28e1891209e4eb3d8f533519da125848b4f6d1","to_record_id":"pems:proposition:f0c4b0034c1ec3ad2f879130","type":"supports"},{"from_record_digest":"sha256:9bab2ab1b3a9dc499b304e32c4389fe15e03e64450d4e4b2e54ef9e04f7817c6","from_record_id":"pems:proposition:eb045961148e3bfa80551936","rationale":"The source supplies concrete verification evidence over authority, role, strengthening the target claim over that governed boundary.","to_record_digest":"sha256:c9242f3057ad0943897b975d2013dec914697e7805c52c6fb48b1386ee6ddde5","to_record_id":"pems:proposition:ef9b4ed34cad26748cd9f40f","type":"supports"},{"from_record_digest":"sha256:9420f1d57c26e80c8fc14cfd495bebbb75032f6e43d0c75aeeae171b268fa588","from_record_id":"pems:proposition:e974d3b9db7ef8468f84c63d","rationale":"The source implements concrete behavior over authority, rupi, strengthening the target contract or plan for that governed boundary.","to_record_digest":"sha256:df5f1dfee4b679ff656b52c2244d3293cf8fce3b09d70d57ca83238d21ecec79","to_record_id":"pems:proposition:ea587b249859769a2b2136ef","type":"supports"}],"contract":"reasoning-distiller-relationship-analysis-result/1","input_batch_digest":"sha256:0eacc606ab5cd5db69c244006906d6919bc44614747d3ca27ebfb60934039aa4","result_digest":"sha256:8be582ff5ac221a2a5d107d4378328cf01133d752a23b71935edb74318e1b20d","status":"COMPLETE"}
