{"algorithm_id":"A0-exhaustive/1","analyzer":{"authority":"none","model":"GPT-5.6 Sol","protocol":"reasoning-distiller-fixed-relation-analyzer/1"},"assessed_hypothesis_count":7168,"assessed_pair_count":1024,"batch_id":"A0-B03-B07","benchmark_id":"relationship-discovery-v1","candidate_relations":[{"from_record_digest":"sha256:d88407cc8b64ef46926a36a21f7377af861566d1171fb5fda28e6caca5b339ac","from_record_id":"pems:proposition:52b92ba6950ffc588ceb7c71","rationale":"The source supplies concrete verification evidence over agent, grant, human, strengthening the target claim over that governed boundary.","to_record_digest":"sha256:2ff44154085260209c2545ae73c6f6f72493dcfdbd74c6cf9b4b1396f2a3b4f1","to_record_id":"pems:proposition:b9e30ee7475d032ac8a3df4f","type":"supports"},{"from_record_digest":"sha256:4dd902ee0317fc1ceaf10763454756d9fc6bb4b506279f3c1e69c8cc291c48e9","from_record_id":"pems:proposition:52af25e2c68c8139e68a18cd","rationale":"The source states a more specific compatible constraint over agent, human, strengthening the target claim over the same governed boundary.","to_record_digest":"sha256:2ff44154085260209c2545ae73c6f6f72493dcfdbd74c6cf9b4b1396f2a3b4f1","to_record_id":"pems:proposition:b9e30ee7475d032ac8a3df4f","type":"supports"},{"from_record_digest":"sha256:2ff44154085260209c2545ae73c6f6f72493dcfdbd74c6cf9b4b1396f2a3b4f1","from_record_id":"pems:proposition:b9e30ee7475d032ac8a3df4f","rationale":"The source states a more specific compatible constraint over agent, grant, human, strengthening the target claim over the same governed boundary.","to_record_digest":"sha256:c990d0a929c9e0da95a4bac3d565c0456c227b85750c93fed4716500d59fb9f5","to_record_id":"pems:proposition:65a0df5eef6afd568980ae37","type":"supports"},{"from_record_digest":"sha256:9e2f2cae124c639ae45daca36c69804882083cffa80da4261a6bf6f5ec37414a","from_record_id":"pems:proposition:b836cade15ddbcfed78b8b41","rationale":"The source supplies concrete verification evidence over candidate, evidence, strengthening the target claim over that governed boundary.","to_record_digest":"sha256:6b2bf328e93f8d0967e228ba0ea62f7e61d5e09c990481dcfd1c71d6b0c10af5","to_record_id":"pems:proposition:54e8679dba22d555a64da5a7","type":"supports"},{"from_record_digest":"sha256:af6efe7f6f3bb1861162125f9a730c8ba4ec241b2e60449ce6c7af99d0ccda33","from_record_id":"pems:proposition:51e90663956c93402e7424f1","rationale":"The source supplies concrete verification evidence over admission, candidate, reconciliation, strengthening the target claim over that governed boundary.","to_record_digest":"sha256:4492d1de1c3db1e611c6e3b64a399ad682cd67fb4ad03819e5219099b69bfae3","to_record_id":"pems:proposition:bcd4e8b565d6334b417e6745","type":"supports"},{"from_record_digest":"sha256:fa10f7079c33a6123820784b3d1808bac1f1d466f252758e63011e8f3393bb9c","from_record_id":"pems:proposition:b98458431bee2b5169000325","rationale":"The source implements concrete behavior over identity, project, strengthening the target contract or plan for that governed boundary.","to_record_digest":"sha256:f47af853764ae9f3a59c2e666d405c033dba8806a68f9982250ca616e43ba79e","to_record_id":"pems:proposition:58e4bef13920b5b1bfa67f97","type":"supports"},{"from_record_digest":"sha256:af6efe7f6f3bb1861162125f9a730c8ba4ec241b2e60449ce6c7af99d0ccda33","from_record_id":"pems:proposition:51e90663956c93402e7424f1","rationale":"The source supplies concrete verification evidence over admission, candidate, reconciliation, strengthening the target claim over that governed boundary.","to_record_digest":"sha256:ef6096cc58879cbe5bd5a6179f71c83fbddc4b3354104e0f2d5c532c6c030efc","to_record_id":"pems:proposition:b323fc3103599b32373489c3","type":"supports"},{"from_record_digest":"sha256:a87c549b98d9aa0ff89f96b5b6333afdfb8d0788874b76b47586d0dccba966eb","from_record_id":"pems:proposition:b5e182a801769d29b29cd056","rationale":"The source supplies concrete verification evidence over package, project, strengthening the target claim over that governed boundary.","to_record_digest":"sha256:21210a1f3131c1321c9f7a501c0a4f1f6b99b3dcb185834ff24482f597f56594","to_record_id":"pems:proposition:5f5ab50cf4aa7a0999284a15","type":"supports"},{"from_record_digest":"sha256:a87c549b98d9aa0ff89f96b5b6333afdfb8d0788874b76b47586d0dccba966eb","from_record_id":"pems:proposition:b5e182a801769d29b29cd056","rationale":"The source supplies concrete verification evidence over package, project, strengthening the target claim over that governed boundary.","to_record_digest":"sha256:f47af853764ae9f3a59c2e666d405c033dba8806a68f9982250ca616e43ba79e","to_record_id":"pems:proposition:58e4bef13920b5b1bfa67f97","type":"supports"},{"from_record_digest":"sha256:9f2894f68fff0084f1ba9cbb6649aeb6e16ac67e6375e3e2ce509b492e84e79c","from_record_id":"pems:proposition:63a3be8dc2f7dc8016e7ebfb","rationale":"The source implements concrete behavior over admission, canonical, strengthening the target contract or plan for that governed boundary.","to_record_digest":"sha256:4492d1de1c3db1e611c6e3b64a399ad682cd67fb4ad03819e5219099b69bfae3","to_record_id":"pems:proposition:bcd4e8b565d6334b417e6745","type":"supports"},{"from_record_digest":"sha256:d7e76416ee37f44690519f7237445afafa6b25710fad9c92929aa578ce4ee283","from_record_id":"pems:proposition:b514f9c1f202fc360fc23aaa","rationale":"The source supplies concrete verification evidence over authority, grant, strengthening the target claim over that governed boundary.","to_record_digest":"sha256:c990d0a929c9e0da95a4bac3d565c0456c227b85750c93fed4716500d59fb9f5","to_record_id":"pems:proposition:65a0df5eef6afd568980ae37","type":"supports"}],"contract":"reasoning-distiller-relationship-analysis-result/1","input_batch_digest":"sha256:07baf945c3bfb6e97c597444d3204e11d66b79df64e3d832079bc28f8ddaea00","result_digest":"sha256:b440017227da1b92cc372dd850155bcc18da60256948d8acdafcb7622fbf61c0","status":"COMPLETE"}
