{"algorithm_id":"A0-exhaustive/1","analyzer":{"authority":"none","model":"GPT-5.6 Sol","protocol":"reasoning-distiller-fixed-relation-analyzer/1"},"assessed_hypothesis_count":7168,"assessed_pair_count":1024,"batch_id":"A0-B07-B10","benchmark_id":"relationship-discovery-v1","candidate_relations":[{"from_record_digest":"sha256:2ff44154085260209c2545ae73c6f6f72493dcfdbd74c6cf9b4b1396f2a3b4f1","from_record_id":"pems:proposition:b9e30ee7475d032ac8a3df4f","rationale":"The source states a more specific compatible constraint over agent, grant, human, strengthening the target claim over the same governed boundary.","to_record_digest":"sha256:15b30c20c24c2b252b7c0139fa28e1891209e4eb3d8f533519da125848b4f6d1","to_record_id":"pems:proposition:f0c4b0034c1ec3ad2f879130","type":"supports"},{"from_record_digest":"sha256:5f4fdf71dd058abaed710177380f22dc7ba3abd533ac00a19142e53f474c2a01","from_record_id":"pems:proposition:eab00cea13fe3d0fcc2d13e7","rationale":"The source supplies concrete verification evidence over rgp, submission, strengthening the target claim over that governed boundary.","to_record_digest":"sha256:4492d1de1c3db1e611c6e3b64a399ad682cd67fb4ad03819e5219099b69bfae3","to_record_id":"pems:proposition:bcd4e8b565d6334b417e6745","type":"supports"},{"from_record_digest":"sha256:7e631cf073d27067f3f01b121a2c710f0fac3ab7d6f0daabc6c5543fd1d360cd","from_record_id":"pems:proposition:e5eaf92a135afabfaaffee2d","rationale":"The source supplies concrete verification evidence over agent, human, strengthening the target claim over that governed boundary.","to_record_digest":"sha256:2ff44154085260209c2545ae73c6f6f72493dcfdbd74c6cf9b4b1396f2a3b4f1","to_record_id":"pems:proposition:b9e30ee7475d032ac8a3df4f","type":"supports"},{"from_record_digest":"sha256:9420f1d57c26e80c8fc14cfd495bebbb75032f6e43d0c75aeeae171b268fa588","from_record_id":"pems:proposition:e974d3b9db7ef8468f84c63d","rationale":"The source implements concrete behavior over authority, steward, strengthening the target contract or plan for that governed boundary.","to_record_digest":"sha256:89109e740311d18d9644ace6d3f61532c0a6d15d463a6187a0747a6756417521","to_record_id":"pems:proposition:b32ba462b7126ee805f35e78","type":"supports"},{"from_record_digest":"sha256:ef6096cc58879cbe5bd5a6179f71c83fbddc4b3354104e0f2d5c532c6c030efc","from_record_id":"pems:proposition:b323fc3103599b32373489c3","rationale":"The source states a more specific compatible constraint over admission, authority, candidate, distiller, strengthening the target claim over the same governed boundary.","to_record_digest":"sha256:c9242f3057ad0943897b975d2013dec914697e7805c52c6fb48b1386ee6ddde5","to_record_id":"pems:proposition:ef9b4ed34cad26748cd9f40f","type":"supports"},{"from_record_digest":"sha256:79705124dfb5d0b1fa5a34daebf2f109a74eb6fc271837281082948d2af2621b","from_record_id":"pems:proposition:efa6ef0aa9f2c44995a2f6ac","rationale":"The source supplies concrete verification evidence over operator, strengthening the target claim over that governed boundary.","to_record_digest":"sha256:d4529ae1f2fe6e98b2199875577bde339ddbaec5678f42560e4d2734e29810ef","to_record_id":"pems:proposition:b18c7da7e9ca662b1e6cdb0a","type":"supports"},{"from_record_digest":"sha256:f10d70fb0c68b60b8769d20c9407a26df04da72ae5175c8a4c03c3315eedb214","from_record_id":"pems:proposition:edaa40e0712a372141d8816d","rationale":"The source states a more specific compatible constraint over agent, grant, strengthening the target claim over the same governed boundary.","to_record_digest":"sha256:2ff44154085260209c2545ae73c6f6f72493dcfdbd74c6cf9b4b1396f2a3b4f1","to_record_id":"pems:proposition:b9e30ee7475d032ac8a3df4f","type":"supports"},{"from_record_digest":"sha256:d7e76416ee37f44690519f7237445afafa6b25710fad9c92929aa578ce4ee283","from_record_id":"pems:proposition:b514f9c1f202fc360fc23aaa","rationale":"The source supplies concrete verification evidence over authority, grant, strengthening the target claim over that governed boundary.","to_record_digest":"sha256:15b30c20c24c2b252b7c0139fa28e1891209e4eb3d8f533519da125848b4f6d1","to_record_id":"pems:proposition:f0c4b0034c1ec3ad2f879130","type":"supports"},{"from_record_digest":"sha256:26e50bac781969f58d3616b5025b4d122263d254846008a3b8bc462a43e4a5fd","from_record_id":"pems:proposition:e7a4b0b541999b16691bbe61","rationale":"The source implements concrete behavior over authority, distiller, project, strengthening the target contract or plan for that governed boundary.","to_record_digest":"sha256:ef6096cc58879cbe5bd5a6179f71c83fbddc4b3354104e0f2d5c532c6c030efc","to_record_id":"pems:proposition:b323fc3103599b32373489c3","type":"supports"},{"from_record_digest":"sha256:9bab2ab1b3a9dc499b304e32c4389fe15e03e64450d4e4b2e54ef9e04f7817c6","from_record_id":"pems:proposition:eb045961148e3bfa80551936","rationale":"The source supplies concrete verification evidence over activation, authority, strengthening the target claim over that governed boundary.","to_record_digest":"sha256:89109e740311d18d9644ace6d3f61532c0a6d15d463a6187a0747a6756417521","to_record_id":"pems:proposition:b32ba462b7126ee805f35e78","type":"supports"}],"contract":"reasoning-distiller-relationship-analysis-result/1","input_batch_digest":"sha256:3b5a45eb2bfc4061100a3c75afcf465f600fd6e1d96380872eeec898f1fd616d","result_digest":"sha256:e25d393121c7287ea20b8354b49044d53d5ebaa429ca033f9d093d16ad515c56","status":"COMPLETE"}
