{"algorithm_id":"A0-exhaustive/1","analyzer":{"authority":"none","model":"GPT-5.6 Sol","protocol":"reasoning-distiller-fixed-relation-analyzer/1"},"assessed_hypothesis_count":7168,"assessed_pair_count":1024,"batch_id":"A0-B00-B04","benchmark_id":"relationship-discovery-v1","candidate_relations":[{"from_record_digest":"sha256:185ba97cca1b057e3565385ba6d94b44be8822c782b28759775fe9c140d73ed9","from_record_id":"pems:proposition:74454f6b8d716ddb7a234780","rationale":"The install-package contract's explicit statement that manifest content identity is package semantic identity strengthens the broader accepted contract proposition defining semantic identity at the manifest-content layer.","to_record_digest":"sha256:18b63a81d3d55a642fb2896ef58c7ec7712465535f2ec2d4e1254fcf02b96090","to_record_id":"pems:proposition:1429c6189decbce4202e5cce","type":"supports"},{"from_record_digest":"sha256:ee79a619400ddd493f66f9686bdd1d82cc7506ad977a542992eb1afd6c56fbe4","from_record_id":"pems:proposition:7458da4d8dada1fd9c659b0a","rationale":"The contract's separate verification of transport SHA-256 over exact archive bytes strengthens the broader proposition that transport integrity is distinct from package semantic content identity.","to_record_digest":"sha256:18b63a81d3d55a642fb2896ef58c7ec7712465535f2ec2d4e1254fcf02b96090","to_record_id":"pems:proposition:1429c6189decbce4202e5cce","type":"supports"},{"from_record_digest":"sha256:3e05221eb17aca9bd5a3cf1a6d2103d078a0ca6d5bfedb3edf83459347d2a371","from_record_id":"pems:proposition:7e28ff99277d56f648462246","rationale":"The package-builder tests show semantic content changes alter content identity and source-commit changes alter semantic package identity while deterministic packaging remains stable, strengthening the accepted package-identity contract.","to_record_digest":"sha256:18b63a81d3d55a642fb2896ef58c7ec7712465535f2ec2d4e1254fcf02b96090","to_record_id":"pems:proposition:1429c6189decbce4202e5cce","type":"supports"},{"from_record_digest":"sha256:f95550c6ec6de12240a2af22573b77e33d18c2125f41e0112650a2ba542964bf","from_record_id":"pems:proposition:6b0a67767cc73b4604bd6ccc","rationale":"The authority-grant runtime's immediately-before revalidation and refusal of non-APPLICABLE proposals is a concrete mutation path that strengthens the broader RIL mutation-runtime proposition about proposal revalidation before state transition.","to_record_digest":"sha256:5d4eefb612451eaa25776dda36263730e961ca40a0dbb83dd7d292d9639b8016","to_record_id":"pems:proposition:135a86b970c68d4d881b4ab2","type":"supports"},{"from_record_digest":"sha256:56ce3fd2230aeb94fb3ee08a077abb38f16c7ab7f2e4715eee5f02b2d1fadbda","from_record_id":"pems:proposition:65e00b11fe22f4a00f2b2a47","rationale":"The bootstrap tests independently verify bootstrap creates no authority or canonical state, strengthening the Rupi handoff boundary that keeps protected authority setup outside install/bootstrap lifecycle work.","to_record_digest":"sha256:4d01f7d31293b1466153f4012a523721a47c482698b92b08266008aa3757722d","to_record_id":"pems:proposition:1061329363158516ff02dedf","type":"supports"},{"from_record_digest":"sha256:94cd791da1d244f635f1910de381037fcbf15319ccce1a6c625fb8fa1ced68e7","from_record_id":"pems:proposition:75c312c7e405f8660356a286","rationale":"The companion proposal-revalidation contract states that APPLICABLE grants no authority and stale, blocked, or invalid results forbid fresh approval, strengthening the broader requirement that approval never freezes or waives later apply-time validation.","to_record_digest":"sha256:e07cf0da80299dd33835aa8a79cd3d1053ebaef1e7e2b9cfdd22f64dfba555c8","to_record_id":"pems:proposition:0f877238978f9c1a882315fc","type":"supports"},{"from_record_digest":"sha256:80f1e4d12284ac35a43194e023a87c4284a75f43d430b1f145e9643e4568b0c2","from_record_id":"pems:proposition:812904f4cfbddefb8278d3be","rationale":"The Distiller ingestion tests verify missing project configuration fails closed along with reserved-root and symlink protections, strengthening the entrypoint proposition that malformed or unsupported project configuration fails closed.","to_record_digest":"sha256:adc175d0ef48e7c3934e7d042ed7e8abfd40a731d9dfcd49b13d922671889815","to_record_id":"pems:proposition:027b666182796272fe2d1806","type":"supports"},{"from_record_digest":"sha256:9be3f8853ac437946ea48af35cd849a7d5bde9d72d4554402e64f06d5c8f2039","from_record_id":"pems:proposition:01106db82e3e61013599154d","rationale":"The checkpoint adapter's deterministic read-only behavior and refusal to invoke mutation primitives strengthens the lifecycle-agent contract that lifecycle truth is reconstructed from accepted status and durable state rather than a private authoritative progress database.","to_record_digest":"sha256:7c722ae384c216799a708bf55cc75b9243409a7532f20596285c466b2f684344","to_record_id":"pems:proposition:761addcb83748517dd2839e5","type":"supports"}],"contract":"reasoning-distiller-relationship-analysis-result/1","input_batch_digest":"sha256:80b315970b18d54f5360ef6680989a964e5fdc32ce7723c608134db45f3298e4","result_digest":"sha256:2e6e67948ff29ea6b7d47c7ce0ada244631076a1351ef1788e8eb5f4862b38e1","status":"COMPLETE"}
