{"algorithm_id":"A0-exhaustive/1","analyzer":{"authority":"none","model":"GPT-5.6 Sol","protocol":"reasoning-distiller-fixed-relation-analyzer/1"},"assessed_hypothesis_count":7168,"assessed_pair_count":1024,"batch_id":"A0-B04-B08","benchmark_id":"relationship-discovery-v1","candidate_relations":[{"from_record_digest":"sha256:5741a68e9385e4c61f1e54f56ef9913047c328fe1992fa5b57d0620eac362713","from_record_id":"pems:proposition:6951729628c25342daddb5f6","rationale":"The source implements concrete behavior over workflow, strengthening the target contract or plan for that governed boundary.","to_record_digest":"sha256:13fe644625bd03a3ade78f98833ad9707ca1d72c2931c4bbe46d43246f9e6ed5","to_record_id":"pems:proposition:ca24a1d3b570badfcda68b2c","type":"supports"},{"from_record_digest":"sha256:759d2bbf3cefdaaf423bea8c75454e36031dc0301736fd686f4346466e652aa6","from_record_id":"pems:proposition:c7573f56fc5f65faaffb1947","rationale":"The source states a more specific compatible constraint over identity, install, package, strengthening the target claim over the same governed boundary.","to_record_digest":"sha256:185ba97cca1b057e3565385ba6d94b44be8822c782b28759775fe9c140d73ed9","to_record_id":"pems:proposition:74454f6b8d716ddb7a234780","type":"supports"},{"from_record_digest":"sha256:56ce3fd2230aeb94fb3ee08a077abb38f16c7ab7f2e4715eee5f02b2d1fadbda","from_record_id":"pems:proposition:65e00b11fe22f4a00f2b2a47","rationale":"The source supplies concrete verification evidence over authority, canonical, project, strengthening the target claim over that governed boundary.","to_record_digest":"sha256:1184cc495a4987d010374c47d3c8c976347e1b0b77be8458dfafe99425216808","to_record_id":"pems:proposition:c9e5d1fde41ae6cf3cd76017","type":"supports"},{"from_record_digest":"sha256:759d2bbf3cefdaaf423bea8c75454e36031dc0301736fd686f4346466e652aa6","from_record_id":"pems:proposition:c7573f56fc5f65faaffb1947","rationale":"The source states a more specific compatible constraint over identity, install, package, strengthening the target claim over the same governed boundary.","to_record_digest":"sha256:ee79a619400ddd493f66f9686bdd1d82cc7506ad977a542992eb1afd6c56fbe4","to_record_id":"pems:proposition:7458da4d8dada1fd9c659b0a","type":"supports"},{"from_record_digest":"sha256:6b52a037d877a7d3ce8d132995d26f32cbda119a57d01a9f05b4393ac19686c7","from_record_id":"pems:proposition:c4897fd559415c3ebe8e3fb0","rationale":"The source supplies concrete verification evidence over authority, grant, strengthening the target claim over that governed boundary.","to_record_digest":"sha256:f95550c6ec6de12240a2af22573b77e33d18c2125f41e0112650a2ba542964bf","to_record_id":"pems:proposition:6b0a67767cc73b4604bd6ccc","type":"supports"},{"from_record_digest":"sha256:56ce3fd2230aeb94fb3ee08a077abb38f16c7ab7f2e4715eee5f02b2d1fadbda","from_record_id":"pems:proposition:65e00b11fe22f4a00f2b2a47","rationale":"The source supplies concrete verification evidence over authority, project, strengthening the target claim over that governed boundary.","to_record_digest":"sha256:868505262653ebb387da4601816b6fe76dd40ad379ce009cd39ab2ab06878dfb","to_record_id":"pems:proposition:c0bf0280dc6712beffb0b7ab","type":"supports"},{"from_record_digest":"sha256:bb6450f62ae6a61706ee2958161076cd2a34cf21bb2ad5ed4b1f0b260e1858d2","from_record_id":"pems:proposition:6cbbf81941480a7592aac79c","rationale":"The source supplies concrete verification evidence over activation, admission, canonical, evidence, strengthening the target claim over that governed boundary.","to_record_digest":"sha256:102da5e2549a671b70690bd29c10537cfd48e38a38c3b3cc041d6edb27f8ac50","to_record_id":"pems:proposition:c96f7d259014776d56cc50f6","type":"supports"},{"from_record_digest":"sha256:3e05221eb17aca9bd5a3cf1a6d2103d078a0ca6d5bfedb3edf83459347d2a371","from_record_id":"pems:proposition:7e28ff99277d56f648462246","rationale":"The source supplies concrete verification evidence over identity, package, source, strengthening the target claim over that governed boundary.","to_record_digest":"sha256:759d2bbf3cefdaaf423bea8c75454e36031dc0301736fd686f4346466e652aa6","to_record_id":"pems:proposition:c7573f56fc5f65faaffb1947","type":"supports"},{"from_record_digest":"sha256:38dfa545d7509c98f346584ed06e282ab33a99d81cd718226e4d82587cd7f982","from_record_id":"pems:proposition:bfa70ad3728c8fe35db36635","rationale":"The source supplies concrete verification evidence over installer, package, workflow, strengthening the target claim over that governed boundary.","to_record_digest":"sha256:7a20360cc24d1941835c9e1455b0c8abdbdb608ae32a6c60467f63fdd4f65ac5","to_record_id":"pems:proposition:72ceecf8a4488d6a1554b28e","type":"supports"},{"from_record_digest":"sha256:bb6450f62ae6a61706ee2958161076cd2a34cf21bb2ad5ed4b1f0b260e1858d2","from_record_id":"pems:proposition:6cbbf81941480a7592aac79c","rationale":"The source supplies concrete verification evidence over activation, authority, canonical, strengthening the target claim over that governed boundary.","to_record_digest":"sha256:1184cc495a4987d010374c47d3c8c976347e1b0b77be8458dfafe99425216808","to_record_id":"pems:proposition:c9e5d1fde41ae6cf3cd76017","type":"supports"},{"from_record_digest":"sha256:923e75c9e0bf6cecc8da52ce77dc044e7eabb7e102b7dac49f36d7e3413e69d7","from_record_id":"pems:proposition:7a0f7b651e955dc7907e03ce","rationale":"The source implements concrete behavior over admission, canonical, pems, strengthening the target contract or plan for that governed boundary.","to_record_digest":"sha256:102da5e2549a671b70690bd29c10537cfd48e38a38c3b3cc041d6edb27f8ac50","to_record_id":"pems:proposition:c96f7d259014776d56cc50f6","type":"supports"},{"from_record_digest":"sha256:6b52a037d877a7d3ce8d132995d26f32cbda119a57d01a9f05b4393ac19686c7","from_record_id":"pems:proposition:c4897fd559415c3ebe8e3fb0","rationale":"The source supplies concrete verification evidence over authority, grant, strengthening the target claim over that governed boundary.","to_record_digest":"sha256:d5a2db43092a58f203c95d0057f95a6378e049341ba93a8f9168c22cdb1c9cc3","to_record_id":"pems:proposition:74c07806d79862c01cc8e087","type":"supports"},{"from_record_digest":"sha256:7a20360cc24d1941835c9e1455b0c8abdbdb608ae32a6c60467f63fdd4f65ac5","from_record_id":"pems:proposition:72ceecf8a4488d6a1554b28e","rationale":"The source implements concrete behavior over canonical, package, strengthening the target contract or plan for that governed boundary.","to_record_digest":"sha256:1184cc495a4987d010374c47d3c8c976347e1b0b77be8458dfafe99425216808","to_record_id":"pems:proposition:c9e5d1fde41ae6cf3cd76017","type":"supports"},{"from_record_digest":"sha256:56ce3fd2230aeb94fb3ee08a077abb38f16c7ab7f2e4715eee5f02b2d1fadbda","from_record_id":"pems:proposition:65e00b11fe22f4a00f2b2a47","rationale":"The source supplies concrete verification evidence over authority, bootstrap, strengthening the target claim over that governed boundary.","to_record_digest":"sha256:97b7c0a8762c1ff00b2742cdfe4d03b4b7d1f9afa7988da57d74937bd1ecd4f2","to_record_id":"pems:proposition:c59d6ac34ff4998565da9209","type":"supports"},{"from_record_digest":"sha256:7a20360cc24d1941835c9e1455b0c8abdbdb608ae32a6c60467f63fdd4f65ac5","from_record_id":"pems:proposition:72ceecf8a4488d6a1554b28e","rationale":"The source implements concrete behavior over installer, package, strengthening the target contract or plan for that governed boundary.","to_record_digest":"sha256:759d2bbf3cefdaaf423bea8c75454e36031dc0301736fd686f4346466e652aa6","to_record_id":"pems:proposition:c7573f56fc5f65faaffb1947","type":"supports"}],"contract":"reasoning-distiller-relationship-analysis-result/1","input_batch_digest":"sha256:ce5b79db39f4f32384477ba2be1abeb1f0d6cfa3a0c2dc7ae551e31478d3b525","result_digest":"sha256:a426cdf6e4d34b7fa03d43d82cfe737b6e5e00d43abf3e319b0c0045e18ee002","status":"COMPLETE"}
